{
  "schema_version": "1.0.0-draft.1",
  "snapshot_id": "urn:foi-process:replay-snapshot:sha256:97dec68431b6259579f4b153c8f89aa0bacd617ecf320f44a65f733d5e56c0e6",
  "consumer": "urn:foi-process:consumer:fixture",
  "created_at": "2026-07-09T00:05:00Z",
  "records": [
    {
      "logical_record_id": "urn:fyi-nz:message:1",
      "revision": 1,
      "current_digest": "b47b0689920bfb13bd9dfc74eea1dbd8cddc3461e43e17100ecb10285e145713",
      "last_delta_id": "urn:foi-process:delta:sha256:7a6b684ec955b07f426d31eafaec0122e8b8fe064f78d8b442267850a74ceed1",
      "last_event_id": "urn:foi-process:event:sha256:488318155be303cd1835042fc3a76276014006f5d77eae0509c6121eff97f019"
    },
    {
      "logical_record_id": "urn:fyi-nz:message:2",
      "revision": 1,
      "current_digest": "3ef25c849197ef76226ed8bb9b8aa4dc0212702980f2eb38b1ab98ee0c9a9647",
      "last_delta_id": "urn:foi-process:delta:sha256:4533c518312e40734eedec265546aca351a9e79284d78cd1c0a3e68b01a51ee8",
      "last_event_id": "urn:foi-process:event:sha256:a69853571fb4dc70389c98082684cfdef20bc844e617ab5109f7556931cb0824"
    },
    {
      "logical_record_id": "urn:fyi-nz:message:3",
      "revision": 2,
      "current_digest": "1bc5ba35cb9794ff3a9a5fbc49425f0c42c4f24594a4b999955984261bc5e566",
      "last_delta_id": "urn:foi-process:delta:sha256:55f4fad97dda71f13fd9be924dee0271587cc1218b8ae215ccc6f4492b309d1b",
      "last_event_id": "urn:foi-process:event:sha256:133b6c39a818dbba4237ed8f9c92753eb6594643eaf0f1465d9a8b91fea95816"
    },
    {
      "logical_record_id": "urn:fyi-nz:message:4",
      "revision": 1,
      "current_digest": "c3eefb58d7c42440a9d4abec51d629544d635a6d936ff3c4d3fca96d611b3cf3",
      "last_delta_id": "urn:foi-process:delta:sha256:213c85d929979191d2d4580b4034b89f221bf01cf246e81b075959f5a8b8bc3a",
      "last_event_id": "urn:foi-process:event:sha256:e66d4ac737f648d564f71e2357a2fa1b5dbc0e1f9d20331ef197e7907f353e07"
    }
  ],
  "partitions": [
    {
      "source": "urn:fyi-cli:site:fyi.org.nz",
      "partition": "requests",
      "last_sequence": 5
    }
  ],
  "state_hash": "87e22761a529068cf1327761441bbd43a260fd8f03f24f6faf1e566e7ed8db97"
}
